"Name","Acronym","Link","Conference dates","Location","Type","Submission date","Notification date","Camera-ready date","Registration date","Topics","Others"
"Symposium of Asian Association for Algorithms and Computation","AAAC","https://cs.kwansei.ac.jp/~tokuyama/AAAC2024.html","May 31 - June 1, 2024","I-site Namba, Osaka, Japan","Offline (in-person)","Submission deadline: March 10, 2024","Notification: April 10, 2024","Camera-ready version due: April 20, 2024","Early registration fee: 20,000JPY (regular), 10,000JPY (students)
Early registration due: April 27, 2024","Theory of Algorithms, Computation Theory, Theoretical Computer Science",""
"Conference on Algorithmic Aspects in Information and Management","AAIM","https://theory.utdallas.edu/AAIM2024/","September 21-23, 2024","University of Texas at Dallas","Online","Paper Submission Deadline: June 10, 2024","Author Notification: July 1, 2024","Camera-Ready Version Due: July 10, 2024","Registration Due: July 10, 2024","Algorithmic Aspects in Information and Management",""
"National Conference of the American Association for Artificial Intelligence","AAAI","https://aaai.org/aaai-24-conference/save-the-date-aaai-25/","February 27 - March 2, 2025","Philadelphia, Pennsylvania, USA","Offline","AAAI-25 web site open for paper submission: July 8, 2024
Abstracts due: August 7, 2024
Full papers due: August 15, 2024
Supplementary material and code due: August 19, 2024","Notification of Phase 1 rejections: October 14, 2024
Notification of final acceptance or rejection: December 9, 2024","Submission of camera-ready files: December 19, 2024","AAAI-25 web site open for author registration: July 1, 2024","Artificial Intelligence","Author feedback window: November 4-8, 2024"
"International Joint Conference on Autonomous Agents and Multiagent Systems (previously the International Conference on Multiagent Systems, ICMAS, changed in 2000)","AAMAS","https://aamas2025.org/","May 19-23, 2025","Detroit Marriott at the Renaissance Center, Detroit, Michigan, USA","Offline","Abstract submission: October 9, 2024
Paper submission: October 16, 2024","Author notification: December 23, 2024","Camera-ready: February 7, 2025","","Autonomous Agents, Multiagent Systems","Rebuttal period: November 27 - December 4, 2024
Tutorials & Workshops: May 19-20, 2025
Main Conference: May 21-23, 2025"
"International Conference Abstract State Machines, Alloy, B, TLA, VDM, and Z (Previously International Conference of B and Z Users, ZB, changed in 2008)","ABZ","https://abz-conf.org/site/2025/calls/","June 11-13, 2025","Düsseldorf, Germany","Offline","Case Study Track Abstract submission: February 3, 2025
Case Study Track Paper submission: February 10, 2025
Case Study Track Final version: April 9, 2025
Main Track Abstract submission: February 3, 2025
Main Track Paper submission: February 10, 2025
Main Track Final version: April 9, 2025
Doctoral Symposium Paper submission: February 24, 2025
Doctoral Symposium Final version: April 9, 2025
Topics: Abstract State Machines, Alloy, B, TLA, VDM, Z","Case Study Track Notification: March 29, 2025
Main Track Notification: March 29, 2025
Doctoral Symposium Notification: March 29, 2025","","","","Workshops and Tutorials: June 10, 2025"
"Applied Computing Conference","ACC","https://www.sigapp.org/sac/sac2025/","March 31 - April 4, 2025","Sicily, Italy","Offline","Submission of track proposals: May 24, 2024
Submission of track CFPs to the Program Chairs: June 7, 2024
Submission of regular papers and SRC research abstracts: October 13, 2024
Submission of Tutorial Proposals: October 11, 2024","Notification of acceptance/rejection of track proposals: May 31, 2024
Notification of Tutorials Acceptance: November 1, 2024
Notification of paper acceptance/rejection: November 22, 2024
Notification of SRC acceptance/rejection: November 22, 2024","Camera-ready copies of accepted papers/SRC: December 13, 2024","Author registration due date: December 20, 2024","Applied Computing",""
"Australasian Conference on Combinatorial Mathematics and Combinatorial Computing","ACCMCC","https://46acc.github.io/registration.html","December 2-6, 2024","The University of Queensland, Australia","Offline","","","","Early Bird Deadline: November 1, 2024
Standard Registration: $520
CMSA Life Member Registration: $485
Unwaged Registration: $280","Combinatorics, Mathematics, Computer Science",""
"International Workshop on Algebraic and Combinatorial Coding Theory","ACCT","https://conferenceindex.org/conferences/coding-theory","","","","","","","","","No information available"
"Asian Conference on Computer Vision","ACCV","https://accv2024.org/important-dates/","December 10-12, 2024","Hanoi, Vietnam","Offline","Paper submission deadline: July 5, 2024
Demo paper submission deadline: August 6, 2024","Reviews are released to authors: August 26, 2024
Paper decision notification: September 20, 2024","Camera-ready deadline: October 11, 2024","Submission registration deadline: July 3, 2024","Computer Vision","Workshop / Challenge proposal deadline: June 9, 2024
Tutorial proposal deadline: June 28, 2024
Supplementary material deadline: July 8, 2024
Rebuttal deadline: September 2, 2024
Workshops / Tutorials: December 8 & 9, 2024"
"ACM International Conference on Advances in Computer Entertainment (merged with DIMEA, Digital Interactive Media in Entertainment and Arts, in 2009)","ACE","https://www.ime.gr/conferences/ace2009/en/index.html","July 9-14, 2023","Toronto, Canada","Offline","","","","Early Registration: June 18, 2023","Computational Linguistics","Tutorials: July 9, 2023
Conference: July 10-12, 2023
Workshops: July 13-14, 2023"
"International Conference on Advances in Computer-Human Interactions","ACHI","https://www.iaria.org/conferences2025/ACHI25.html","May 18-22, 2025","Nice, France","Hybrid","Submission: February 4, 2025","Notification: March 23, 2025","Camera ready: April 13, 2025","Registration: March 30, 2025","Computer-Human Interactions",""
"International Conference on Affective Computing and Intelligent","ACII","https://acii-conf.net/","September 15-18, 2024","Glasgow Grosvenor Hotel, Scotland, UK","Offline","Call for papers for the main conference track: December 11, 2023
Submission deadline for workshop and special track proposals: February 9, 2024
Submission system opens for all tracks: February 15, 2024
Special tracks submission deadline: March 15, 2024
Main track abstract submission deadline: March 15, 2024
Main track paper submission deadline: March 22, 2024
Submission deadline for tutorial proposals: May 15, 2024
Submission deadline for the doctoral consortium: June 16, 2024
Submission deadline for workshops: June 19, 2024
Submission deadline for demos: June 22, 2024
Submission deadline for Late Breaking Results (LBR) papers: June 24, 2024","Notification for special track proposals: February 24, 2024
Notification for workshop proposals: February 28, 2024
Paper notification for the main track: June 7, 2024
Notification for tutorial proposals: June 15, 2024
Notifications for special track papers: June 17, 2024
Notification for demos: July 1, 2024
Notification for the doctoral consortium: July 12, 2024
Notification for workshop: July 14, 2024
Notification for LBR papers: July 20, 2024","Camera ready deadline for main conference track: August 1, 2024
Camera ready deadline for all contributions including LBR: August 1, 2024","Early bird registration deadline: July 22, 2024","Affective Computing, Intelligent Interaction","Calls for workshop and special track proposals: December 11, 2023
Call for special track contributions: February 19, 2024
Rebuttal period: May 15-20, 2024
Workshops, tutorials, and DC: September 15, 2024
Main conference: September 16-18, 2024"
"Australasian Conference on Information Security and Privacy","ACISP","https://uow-ic2.github.io/acisp2025/","September 15-19, 2025","Porto, Portugal","Offline","","","","","Machine Learning, Data Mining, Knowledge Discovery, Workshops, Tutorials, Poster Sessions, Discovery Challenge, Demo Track, Applied Data Science, Industry Track, PhD Forum","No information available
1. Information of ECML PKDD_0:"
"Association for Computational Linguistics","ACL","https://2025.aclweb.org/","July 9-14, 2023","Toronto, Canada","Offline","","","","Early Registration: June 18, 2023","Computational Linguistics","Tutorials: July 9, 2023
Conference: July 10-12, 2023
Workshops: July 13-14, 2023"
"ACM Conference on Security and Privacy in Wireless and Mobile Networks","ACM_WiSec","https://wisec2025.gmu.edu/","May 29 - June 1, 2023","University of Surrey, Guildford, Surrey, United Kingdom","Offline","","","","","Security, Privacy, Wireless Networks, Mobile Networks, Mobile Software Platforms","Workshop Event: June 1, 2023"
"Asian Conference on Machine Learning","ACML","https://www.acml-conf.org/","November 11-14, 2023","İstanbul, Turkey","Offline","Conference Track Submission deadline: June 30, 2023
Journal Track Submission deadline: June 02, 2023
Journal Track Revised manuscript submission deadline (for minor revision papers): September 1, 2023","Conference Track Reviews released to authors: August 18, 2023
Conference Track Acceptance notification: September 8, 2023
Journal Track 1st round review results (accept, minor revision, or reject): July 28, 2023
Journal Track Acceptance notification: September 29, 2023","Conference Track Camera-ready submission deadline: September 29, 2023
Journal Track Camera-ready submission deadline: September 29, 2023","","Machine Learning, Deep Learning, Trustworthy Machine Learning, Theory, Applications","Conference Track Author rebuttal deadline: August 25, 2023"
"Annual Computer Security Applications Conference","ACSAC","https://www.acsac.org/","December 4-8, 2023","Austin, Texas, USA","Offline","","","","","Computer Security, Network Security, Trustworthy Systems, Large Language Models","0"
"Asilomar Conference on Signals, Systems and Computing","ACSSC","https://www.asilomarsscconf.org/","October 29 - November 1, 2023","Pacific Grove, CA, USA","Offline","Conference Paper Submission Deadline: May 1, 2023","","","","Signals, Systems, Computers",""
"International Conference on Artificial Intelligence in Education","AIED","https://iaied.org/news/7GRX3YoWBgJLfJeRBWbbH7","July 3-7, 2023","Tokyo, Japan","Offline","Late-breaking results track submission deadline: March 6, 2023
Bluesky paper track submission deadline: February 20, 2023
Workshops and Tutorials submission deadline: February 20, 2023
Doctoral Consortium submission deadline: February 6, 2023","","","","Artificial Intelligence in Education, AIED",""
"Australasian Information Security Conference","AISC","https://uow-ic2.github.io/acisp2025/","","","","","","","","","No information available"
"ArtsIT, Interactivity & Game Creation (was International Conference on Arts and Technology)","ArtsIT","https://artsit.eai-conferences.org/2024/","November 27-29, 2023","Institute of Philosophy and Human Sciences – IFCH – Marielle Franco and Fausto Castilho Auditoriums, UNICAMP, the State University of Campinas, São Paulo, Brazil","Hybrid (Online participants)","Main Track Full Paper Submission deadline: August 10, 2023
Late Track & Poster Track Paper Submission deadline: September 15, 2023
All Special Tracks Paper Submission deadline: September 15, 2023","Main Track Notification deadline: September 15, 2023
Late Track & Poster Track Notification deadline: October 5, 2023
All Special Tracks Notification deadline: October 5, 2023","Main Track Camera-ready deadline: November 10, 2023
Late Track & Poster Track Camera-ready deadline: November 12, 2023
All Special Tracks Camera-ready deadline: November 12, 2023","","Artificial Intelligence, Big Data, Audio Art, Sonification, Design, Digital Art, Digital Cultural Heritage, Digital Musical Interfaces, Games, Gamification, Human Computer Interaction, Human Robot Interaction, Interactive Art, Interactive Installations, Media Art, Metaverse, Avatars, Presence, Music Therapy, STEAM, Virtual Museums, Virtual Reality, Augmented Reality, Virtual Worlds",""
"International ACM SIGACCESS Conference on Computers and Accessibility","ASSETS","https://assets25.sigaccess.org/","October 23-25, 2023","New York, NY","Offline","Technical Paper Submission Deadline: May 3, 2023
Workshop Proposals Submission Deadline: July 6, 2023
Posters & Demos Experience Reports Submission Deadline: July 7, 2023
Student Research Competition Submission Deadline: July 10, 2023
Doctoral Consortium Submission Deadline: July 17, 2023
Video Presentations Submission Deadline: August 30, 2023","Paper Decisions Released: June 25, 2023","","","Computers and Accessibility, Computing for People with Disabilities","Requesting Mentors Deadline: March 31, 2023
Author Rebuttal Period Opens: June 7, 2023
Author Rebuttal Period Closes: June 15, 2023"
"Architectural Support for Programming Languages and Operating Systems","ASPLOS","https://www.asplos-conference.org/asplos2025/cfp/","March 30 - April 3, 2025","Rotterdam, The Netherlands","Offline","Spring Cycle Abstract Deadline: February 23, 2024
Spring Cycle Paper Deadline: March 1, 2024
Summer Cycle Abstract Deadline: June 17, 2024
Summer Cycle Paper Deadline: June 24, 2024
Fall Cycle Paper Deadline: October 18, 2024","Spring Cycle Notification Date: June 6, 2024
Summer Cycle Notification Date: October 2, 2024
Fall Cycle Notification Date: January 27, 2025","","","Computer Architecture, Programming Languages, Operating Systems, Distributed Systems, Cloud Computing, Mobile and Edge Systems, Secure and Reliable Systems","Spring Cycle Author Response Period: May 15-20, 2024
Summer Cycle Author Response Period: September 9-13, 2024
Fall Cycle Author Response Period: January 13-15, 2025"
"Cooperative Design, Visualization, and Engineering","CDVE","https://www.cdve.org/dates.html","September 15-18, 2024","Valencia, Spain","Offline","Full Papers submission deadline: May 25, 2024
Short papers submission deadline: May 25, 2024
Poster Paper submission deadline: June 25, 2024","Notification of acceptance for full and short papers (second call): June 15, 2024
Notification of acceptance for full and short papers (first call): May 20, 2024
Notification of acceptance for poster papers: July 10, 2024","Final camera ready paper due and registration for all accepted paper authors: June 25, 2024","Early registration for accepted paper authors: June 25, 2024
Early registration for all participants: July 31, 2024
Final poster paper due and registration for accepted paper authors: July 31, 2024","Cooperative Design, Cooperative Visualization, Cooperative Engineering, Cooperative Applications",""
"IEEE Congress on Evolutionary Computation","CEC","https://www.cec2025.org/","June 8-12, 2025","Hangzhou, China","Offline","Paper Submission Deadline: January 15, 2025","Paper Acceptance Notification: March 15, 2025","","Final Paper Submission & Early Registration Deadline: May 1, 2025","Evolutionary Computation, Ant Colony Optimization, Swarm Intelligence, Genetic Algorithms, Genetic Programming, Machine Learning, Optimization, Artificial Life","Special Session & Workshop Proposals Deadline: November 15, 2024
Competition & Tutorial Proposals Deadline: December 15, 2024"
"IEEE International Symposium on Cluster, Cloud and Grid Computing","CCGRID","https://icfec2025.ontariotechu.ca/","May 19-22, 2025","Tromsø, Norway","Offline","Paper submission deadline: January 10, 2025","Author notification: February 28, 2025","Camera-ready submission: March 15, 2025","","Fog Computing, Edge Computing, Federated Learning, 5G, 6G, Cloud Computing, Data Management",""
"Information Security Symposium","CERIAS","https://www.cerias.purdue.edu/site/symposium/","April 1-2, 2025
August 24-26, 2022","West Lafayette, IN
University of Vienna, Vienna, Austria","Offline
Offline","","","","","Cybersecurity, Cyber-Physical Systems, AI Trustworthiness
Machine Learning, Knowledge Extraction, Artificial Intelligence, Data Science, Human-Computer Interaction","9. Information of CD-MAKE_1:"
"International Conference on Complex, Intelligent and Software Intensive Systems","CISIS","https://10times.com/cisis-fukuoka","September 5-7, 2023
September 29 - October 4, 2024
September 29 - October 4, 2024","Hospederia Fonseca, Salamanca, Spain
Raleigh, NC, USA
Raleigh, NC, USA","","Journal Track Abstract Submission: March 24, 2024
Journal Track Full Paper Submission: March 31, 2024
Work-in-Progress and Late Breaking Tracks Paper Submission: June 2, 2024
Abstract Submission: March 24, 2024
Full Paper Submission: March 31, 2024
Revised Paper Submission: June 16, 2024","Journal track First Round Notification: May 19, 2024
Work-in-Progress and Late Breaking Tracks Notification: June 30, 2024
Journal Track Notification: July 14, 2024
First round reviews: May 19, 2024
Notification: July 14, 2024","All tracks Camera ready: August 12, 2024
Camera-ready Submission: August 12, 2024","","Computational Intelligence, Information Security, Data Mining
Hardware/Software Codesign, System Synthesis, Embedded Systems, Cyber-Physical Systems, Internet of Things
System-level design, Domain/application-specific design, System architecture, Simulation, test, validation, and verification, Embedded software, Safety, security, and reliability, Power-aware systems, Embedded machine learning, Industrial practices and case studies","26. Information of CODES+ISSS_0:
27. Information of CODES+ISSS_1:"
"International Conference on Cloud Computing and Services Science","CLOSER","https://closer.scitevents.org/callforpapers.aspx","April 1-3, 2025","Vila Galé Porto hotel, Porto, Portugal","","Regular Papers Paper Submission: November 18, 2024
Position Papers/Regular Papers Paper Submission: December 13, 2024
Abstracts Abstract Submission: January 30, 2025","Regular Papers Authors Notification: January 6, 2025
Position Papers/Regular Papers Authors Notification: January 30, 2025
Abstracts Authors Notification: February 13, 2025","Regular Papers Camera Ready and Registration: January 23, 2025
Position Papers/Regular Papers Camera Ready and Registration: February 12, 2025
Abstracts Camera Ready and Registration: February 21, 2025","","Cloud Computing, Services Science, Cloud Computing Enabling Technology, Cloud Computing Fundamentals, Cloud Computing Platforms and Applications, Edge Cloud and Fog Computing, Services, Cloud Security and Privacy","Workshops Workshop Proposal: November 27, 2024
Special Sessions Special Session Proposal: November 27, 2024
Tutorials Tutorial Proposal: February 18, 2025
Demos Demo Proposal: February 18, 2025
Panels Panel Proposal: February 18, 2025"
"International Conference on Intelligent Text Processing and Computational Linguistics","CICLING","https://conferenceindex.org/event/international-conference-on-intelligent-text-processing-and-computational-linguistics-icitpcl-2025-june-riga-lv","June 17-18, 2025","Riga, Latvia","","Final Submission: May 17, 2025","Notification: December 12, 2024","","","Computational Linguistics, Intelligent Text Processing, Natural Language Processing, Information Retrieval, Machine Learning, Artificial Intelligence",""
"Latin American Conference on Informatics","CLEI","https://clei.org/en/category/news/clei-en/","August 12-16, 2024","Bahía Blanca, Argentina","","Papers submissions: April 12, 2024
Final version: July 19, 2024","Authors notifications and courses selection: June 14, 2024","","","Computer Science, Informatics","ELI courses proposals: April 26, 2024
CLTM and CLTD contest: May 10, 2024"
"IEEE International Conference on Cloud Computing","CLOUD","https://www.ieeecloudsummit.org/2025-cfp","June 26-27, 2025","Washington, D.C., USA","","Paper Submission Deadline: February 1, 2025","Initial Notification: April 1, 2025
Final Notification: April 27, 2025","Camera-Ready Submission: May 17, 2025","Author Registration Deadline: May 27, 2025","Cloud Computing, Edge Computing, AI, Machine Learning, Cloud Applications, Algorithms, Software, System and Networking",""
"IEEE International Conference on Cloud Computing Technology and Science (International Conference on Cloud Computing pre 2010)","CloudCom","https://www.cloudcom2024.org/","December 9-11, 2024","Abu Dhabi, UAE","","Paper submission: September 6, 2024","Special Session/Workshop proposal notification: September 6, 2024
Paper acceptance notification: October 4, 2024
Author Notification: October 4, 2024","Camera-Ready: October 30, 2024","Author Registration: October 30, 2024","Cloud Computing, Edge Computing, Virtualization, Security, Privacy, Big Data, Systems Architecture, Service-Oriented Architecture, High-Performance Computing","Workshop proposal: September 6, 2024"
"International Conference on Network and Service Management (amalgamation of DSOM and related workshops from 2010)","CNSM","https://www.cnsm-conf.org/","October 28-31, 2024","Prague, Czech Republic","","","","","","Network and Service Management, Network Management, Service Management",""
"IEEE International Conference on Cluster Computing","CLUSTER","https://icdcs2025.icdcs.org/","July 20-23, 2025","Glasgow, Scotland, UK","","Research Papers Abstracts: December 4, 2024 (Extended to December 11, 2024)
Research Papers Papers: December 11, 2024 (Extended to December 18, 2024)
Posters Abstracts: January 15, 2025
Posters Papers: January 22, 2025","Research Papers Notification: April 2, 2025
Workshop Proposals Notification: January 15, 2025
Doctoral Consortium Notification: April 2, 2025
Tutorial Proposals Notification: April 2, 2025
Posters Notification: April 2, 2025
Demonstrations Notification: April 2, 2025
Industry Events Notification: April 2, 2025","Research Papers Camera-ready: April 16, 2025
Workshop Proposals Camera-ready: April 16, 2025
Doctoral Consortium Camera-ready: April 16, 2025
Posters Camera-ready: April 16, 2025
Demonstrations Camera-ready: April 16, 2025
Industry Events Camera-ready: April 16, 2025","","Distributed Computing Systems, Cloud Computing, Distributed Algorithms, Big Data, Distributed Fault Tolerance, Distributed OS and Middleware, Edge Computing, IoT, Mobile Computing, Security, Privacy, Blockchains, Databases, AI, Machine Learning","Workshop Proposals: November 27, 2024
Doctoral Consortium: February 26, 2025
Tutorial Proposals: February 26, 2025
Demonstrations: January 22, 2025
Industry Events: February 12, 2025"
"International Conference on Control, Decision and Information Technologies","CoDIT","https://codit2025.org/index.php/registration","July 15-18, 2025
September 29-October 4, 2024
September 29 - October 4, 2024","Split, Croatia
Raleigh, NC, USA
Sheraton Raleigh, Raleigh, NC, USA","","Papers submission deadline: February 7, 2025
Final version due: May 17, 2025","Acceptance notification: April 27, 2025","","Registration deadline: May 17, 2025
Registration deadline: October 4, 2024","Control, Automation, Robotics, Optimization, Decision, Cybernetics, Computer Science, Information Technologies
Hardware/Software Codesign, System Synthesis, Embedded Systems, Cyber-Physical Systems, Internet of Things
Embedded Systems, Components, Circuits, Devices, Systems, Computing, Processing, Signal Processing","30. Information of CODES+ISSS_2:
31. Information of CODES+ISSS_3:"
"Conference on Games (was Computational Intelligence and Games CIG)","COG","https://www.showsbee.com/fairs/IEEE-CoG.html","August 26-29, 2025","Lisbon, Portugal","","","","","","Games, Computational Creativity, Game Design, Game Technology, Artificial Intelligence, Computational Intelligence",""
"Annual Meeting of the Cognitive Science Society","CogSci","https://cognitivesciencesociety.org/cogsci-2025/","July 30 - August 2, 2025","Marriott Marquis, San Francisco, CA, USA","","Submissions open: December 2, 2024
Submissions close: February 1, 2025
Accepted submissions due in final form: May 2025","Author notification of acceptance: April 2025","","Conference registration opens: April 2025
Last day to register at “early bird” conference rate: May 2025","Cognitive Science, Artificial Intelligence, Linguistics, Anthropology, Psychology, Neuroscience, Philosophy, Education","Conference prize nominations open: December 2, 2024
Awards announced: April 2025
Last day to register at “regular” conference rate: June 2025"
"IEEE Conference on Cognitive and Computational Aspects of Situation Management","CogSIMA","https://www.myhuiban.com/conference/2462?lang=en_us","June 2-5, 2025","Duisburg, Germany","","Submission Date: November 29, 2024","Notification Date: February 25, 2025","","","Cognitive Situation Management, Artificial Intelligence, Situation Awareness, Cognitive Science, Human Computer Interaction, Autonomous Systems, Human-Robot Teams, Human-AI Teaming",""
"International Workshop on Coordination, Organizations, Institutions, Norms and Ethics for Governance of Multi-Agent Systems (Ethics added 2020)","COINE","https://coin-workshop.github.io/coine-2020-new-zealand/","May 9, 2020","Auckland, New Zealand","","Paper submission: February 23, 2020","Author notifications: March 10, 2020","Camera-ready deadline: April 15, 2020","","Multi-Agent Systems, Coordination, Organizations, Institutions, Norms, Ethics, Governance",""
"International Conference on Computational Linguistics","COLING","https://coling2025.org/","January 19-24, 2025","Abu Dhabi, UAE","","Direct Submission Deadline: September 16, 2024","Notification of acceptance: November 29, 2024","Camera-Ready Deadline: December 15, 2024","Registration opens: November 30, 2024","Computational Linguistics, Natural Language Processing","ARR Commitment Deadline: October 20, 2024
Arabic NLP Winter School: January 18-19, 2025
Workshop and Tutorials: January 19-20, 2025
Main Conference (In-Person Only): January 21-24, 2025
Main Conference (Virtual Only): January 27-28, 2025"
"ACM International Conference on Emerging Networking Experiments and Technologies","CoNEXT","https://www.myhuiban.com/conference/10?lang=en_us","","","","","","","","","No information available"
