"Name","Acronym","Link","Conference dates","Location","Type","Submission date","Notification date","Camera-ready date","Registration date","Topics","Others"
"Engineering Interactive Computing Systems","EICS","https://eics.acm.org/","June 24-28, 2025","Trier, Germany","Offline","","","","","Interactive Computing Systems, User Interfaces, HCI, Software Engineering, Requirements Engineering","Conference: ACM SIGCHI Symposium on Engineering Interactive Computing Systems (EICS)"
"European-Japanese Conference on Information Modelling and Knowledge Bases","EJC","https://kmeducationhub.de/international-conference-information-modelling-knowledge-bases-ejc/","June 9-13, 2025","Ostrava, Czech Republic","Offline","Submission Deadline: January 17th, 2025
Final paper for inclusion in the conference proceedings: April 25th, 2025
IOS Press version of Papers: September 10th, 2025","Notification of Acceptance: March 30th, 2025","","","Information Modelling, Knowledge Bases, Conceptual Modelling, Knowledge Management, Linguistic Modelling, Cross-cultural Communication, Environmental Modelling, Multimedia Data Modelling, AI System Modelling","Conference: International Conference on Information Modelling and Knowledge Bases (EJC)"
"International Conference on Knowledge Engineering and Knowledge Management","EKAW","https://ic3k.scitevents.org/","November 26-28, 2024","Amsterdam, Netherlands","Offline","Regular Paper Submission Deadline: May 19, 2025
Position/Regular Paper Submission Deadline: June 26, 2025","","","","Knowledge Discovery, Knowledge Engineering, Knowledge Management","Conference: International Conference on Knowledge Engineering and Knowledge Management (EKAW)"
"EMAS (merger of DALT, AOSE and PROMAS)","EMAS","https://2025.emas-online.org/welcome-message/about-emas/","May 14-16, 2025","null","Offline","Abstract submission open: October 17, 2024
Abstract submission deadline: January 17, 2025","","","","Midlife Health, Menopause, Andropause","Conference: European Menopause and Andropause Society (EMAS) Congress"
"Eurographics Symposium on Parallel Graphics and Visualization","EGPGV","https://www.eg.org/wp/event/egpgv-2024-eurographics-symposium-on-parallel-graphics-and-visualization/","May 27, 2024","Odense, Denmark","Offline","","","","","Parallel Graphics, Visualization",""
"Exploring Modelling Methods in Systems Analysis and Design","EMMSAD","https://www.emmsad.org/","June 16-17, 2025","Vienna, Austria","Offline","Abstract submissions (recommended): March 13, 2025
Full paper submissions: March 18, 2025","Notification of acceptance: April 14, 2025","Camera-ready copies: April 21, 2025","Author registration: April 21, 2025","Modeling Methods, Systems Analysis, Systems Development",""
"ACM Conference on Embedded Software","EMSOFT","https://esweek.org/emsoft/","September 29 - October 4, 2024","Raleigh, NC, USA","Offline","Journal Track: Abstract Submission: March 24, 2024
Journal Track: Full Paper Submission: March 31, 2024
Work-in-Progress and Late Breaking Tracks: Paper Submission: June 2, 2024
Journal track: Revised Paper Submission: June 16, 2024","Journal track: First Round Notification: May 19, 2024
Work-in-Progress and Late Breaking Tracks: Notification: June 30, 2024
Journal Track: Notification: July 14, 2024","All tracks (full paper, LB, WiP, Special Session): Camera ready: August 12, 2024","","Embedded Software, Cyber-physical Systems","Conference: ACM SIGBED International Conference on Embedded Software (EMSOFT)"
"Empirical Methods in Natural Language Processing","EMNLP","https://2024.emnlp.org/","November 12-16, 2024","Hyatt Regency Miami Hotel, Miami, Florida","Hybrid","ARR submission deadline (long & short papers): June 15, 2024","Notification of acceptance (long & short papers): September 20, 2024","Camera-ready papers due (long & short): October 3, 2024","","Natural Language Processing, Empirical Methods","Commitment deadline for EMNLP 2024: August 20, 2024
Main Conference: November 12-14, 2024
Workshops and Tutorials: November 15-16, 2024"
"International Conference on Evaluation of Novel Approaches to Software Engineering","ENASE","https://enase.scitevents.org/","June 15-17, 2022","Virtual","Online","Deadline for Paper Submission: April 19, 2022
Submission Deadline for Industry and Tool Demonstration Track: April 15, 2022","Notification Date: May 3, 2022
Notification to Authors for Industry and Tool Demonstration Track: April 22, 2022","Camera Ready: May 17, 2022","","Software Reuse, Software Quality","Conference: International Conference on Software and Systems Reuse (ICSR)
Doctoral Symposium: June 15, 2022
Track Date for Industry and Tool Demonstration Track: June 15-16, 2022"
"International Conference on Information and Communication Technologies in Tourism","ENTER","https://ifitt.net/enter-conference/enter-25/","February 17-21, 2025","Wrocław, Poland","Offline","Submission Deadline: September 15, 2024
Deadline to resubmit revised paper: October 18, 2024","Notification of acceptance: October 1, 2024
Final acceptance decision: November 1, 2024","","","E-tourism, Information and Communication Technologies in Tourism","Conference: ENTER eTourism Conference"
"Portuguese Conference on Artificial Intelligence","EPIA","https://epia2024.pt/","September 3-6, 2024","Viana do Castelo, Portugal","Offline","Paper submission deadline: May 20, 2024","Notification of paper acceptance: June 20, 2024","Camera-ready papers deadline: July 9, 2024","","Artificial Intelligence, Ambient Intelligence, IoT in Agriculture, AI and Law, AI for Industry and Societies, AI in Medicine, AI in Power and Energy Systems, AI in Transportation Systems, Ethics and Responsibility in AI, General Artificial Intelligence, Generative AI, Intelligent Robotics, Knowledge Discovery and Business Intelligence, Natural Language Processing","Conference: International Conference on Artificial Intelligence (EPIA)"
"International Workshop on Enterprise and Organizational Modelling and Simulation","EOMAS","https://eomas2024.fel.cvut.cz/","June 3-4, 2024
June 30 - July 4, 2025","Limassol, Cyprus
Venice, Italy","Offline
Offline","Workshop Papers Submission Date: February 26, 2024
Research Papers Submission deadline: October 24, 2024
Research Papers R1 Rebuttal period: December 12-16, 2024
Research Papers R2 Rebuttal period: January 20-23, 2025
Research Papers Submission of revised papers: March 20, 2025
Research Papers Revision Decisions: April 3, 2025","Workshop Authors Notification: March 27, 2024
Research Papers Early rejection notification: December 11, 2024
Research Papers Author Notification: February 13, 2025","Camera-Ready Papers: April 5, 2024
Research Papers Camera-ready deadline: April 17, 2025","Research Papers Registration deadline (incl. topics and abstracts): October 21, 2024","Enterprise Modeling and Simulation, Information Systems Modeling and Simulation, Business Processes Modeling and Simulation
Computer Security, Privacy, Systematization of Knowledge","Conference: International Workshop on Enterprise & Organizational Simulation and Modelling (EOMAS)
1. Information of EuroS&P_0:"
"Eye Tracking Research and Applications","ETRA","https://etra.acm.org/2025/","May 30 - June 2, 2023","University of Tübingen, Tübingen, Germany","Hybrid","Full Paper Abstract submission (mandatory): October 28, 2022
Full Paper Paper submission: November 4, 2022
Full Paper Revisions due: February 23, 2023
Short Paper Abstract submission (mandatory): January 9, 2023
Short Paper Paper submission: January 16, 2023
Workshop Paper submission: December 5, 2022
Tutorials Paper submission: December 20, 2022
Late-Breaking Work Paper submission: March 15, 2023","Full Paper First round reviews and notifications: January 12, 2023
Full Paper Second round reviews and notifications: March 18, 2023
Short Paper First round reviews and notifications: March 13, 2023
Workshop First round reviews and notifications: December 9, 2022
Late-Breaking Work First round reviews and notifications: March 25, 2023","Full Paper Camera-ready deadline: April 5, 2023
Short Paper Camera-ready deadline: April 5, 2023
Workshop Camera-ready deadline: December 15, 2022
Late-Breaking Work Camera-ready deadline: April 5, 2023","","Eye Tracking Research, Eye Tracking Applications",""
"European SPI","EuroSPI","https://conference.eurospi.net/index.php/submission","September 10-12, 2025
June 30 - July 4, 2025","Riga, Latvia
Venice, Italy","Hybrid
Offline","Paper Submission Deadline: April 11, 2025
Research Papers Submission deadline: October 24, 2024
Research Papers R1 Rebuttal period: December 12-16, 2024
Research Papers R2 Rebuttal period: January 20-23, 2025
Research Papers Submission of revised papers: March 20, 2025
Research Papers Revision Decisions: April 3, 2025","Research Papers Early rejection notification: December 11, 2024
Research Papers Author Notification: February 13, 2025","Research Papers Camera-ready deadline: April 17, 2025","Early Registration Deadline: August 1, 2025
Late Registration: September 9, 2025
Research Papers Registration deadline (incl. topics and abstracts): October 21, 2024","Software Process Improvement, Functional Safety, Cybersecurity, Agile, Lean, Standards, Assessments, Team Skills, Diversity, Innovation, Virtual and Augmented Reality, Medical Big Data
Computer Security, Privacy, Systematization of Knowledge","7. Information of EuroS&P_2:
8. Information of EuroS&P_3:
No information available"
"European Conference on Pattern Languages of Programs","EuroPLop","https://plopcon.org/conferences/","July 2-6, 2025
June 30 - July 4, 2025","Kloster Irsee, Germany
Venice, Italy","Offline
Offline","Research Papers Submission deadline: October 24, 2024
Research Papers R1 Rebuttal period: December 12-16, 2024
Research Papers R2 Rebuttal period: January 20-23, 2025
Research Papers Submission of revised papers: March 20, 2025
Research Papers Revision Decisions: April 3, 2025","Research Papers Early rejection notification: December 11, 2024
Research Papers Author Notification: February 13, 2025","Research Papers Camera-ready deadline: April 17, 2025","Research Papers Registration deadline (incl. topics and abstracts): October 21, 2024","Pattern Languages of Programs, Software Design Patterns, Agile Processes, API Design, Domain-Driven Design, Business Patterns, Educational Patterns, Cloud Patterns, Internet of Things Patterns
Computer Security, Privacy, Systematization of Knowledge","4. Information of EuroS&P_1:"
"Eurosys Conference","EuroSys","https://2025.eurosys.org/","March 30-April 3, 2025","Rotterdam, The Netherlands","Offline","Spring deadline Paper titles and abstracts due: May 14, 2024
Spring deadline Full paper submissions due: May 21, 2024
Spring deadline Author responses due: August 2, 2024
Fall deadline Paper titles and abstracts due: October 15, 2024
Fall deadline Full paper submissions due: October 22, 2024
Fall deadline Author responses due: January 9, 2025","Spring deadline Reviews available: July 31, 2024
Spring deadline Notification to authors: August 21, 2024
Fall deadline Reviews available: January 7, 2025
Fall deadline Notification to authors: January 25, 2025","Spring deadline Camera-ready deadline: September 23, 2024
Fall deadline Camera-ready deadline: February 28, 2025","","Systems Software, Operating Systems, Distributed Systems, Cloud Computing, File and Storage Systems, Networked Systems, Systems Security, Dependable Systems",""
"Visual Analytics","EuroVA","https://www.eurova.org/","May 27, 2024","Odense, Denmark","Offline","Submission Deadline: March 1, 2024","Notification: April 12, 2024","Camera-ready: April 26, 2024","","Visual Analytics, Immersive Analytics, Human-Centered Visual Analytics, Decision Making, Explainable AI, Scalable Visual Analytics, Machine Learning, Uncertainty-Aware Visual Analytics, Visual Data Science",""
"Eurographics/IEEE Symposium on Visualization","EuroVis","https://www.eurovis2025.lu/for-submitters","June 2-6, 2025","Luxembourg City, Luxembourg","Offline","Dirk Bartz Prize Submission deadline: February 10, 2025
Full Papers Abstract deadline: November 27, 2024
Full Papers Full paper deadline: December 4, 2024
Full Papers Revised Submission: March 5, 2025
Short Papers Submission deadline: February 19, 2025
STARs Submission of STAR Sketch: October 14, 2024
STARs Invitation for full STAR submission: November 4, 2024
STARs Submission of full STAR: January 13, 2025
STARs Second round submission: March 31, 2025
Panels & Tutorials Submission deadline: February 26, 2025
Workshops Proposal Submission: November 11, 2024
Education Papers Submission: January 8, 2025","Dirk Bartz Prize Notification: March 31, 2025
Full Papers First Round Notification: February 12, 2025
Full Papers Final Notification: March 19, 2025
Short Papers Acceptance notification: April 2, 2025
STARs Full STAR notification: March 10, 2025
STARs Second review notification: April 14, 2025
Panels & Tutorials Notification (conditional acceptance): March 5, 2025
Workshops Notification: November 25, 2024
Education Papers Notification: March 4, 2025","Dirk Bartz Prize Camera Ready: April 14, 2025
Full Papers Camera Ready Version: April 16, 2025
Short Papers Camera ready version: April 23, 2025
STARs Camera-ready deadline: April 28, 2025
Panels & Tutorials Abstracts submission (camera-ready): April 16, 2025
Education Papers Camera-Ready: March 25, 2025","","Data Visualization, Visual Analytics",""
"Conference of the European Society for Fuzzy Logic and Technologies","EUSFLAT","https://eusflat2025.eu/","July 21-25, 2025","House of Science, University of Latvia, Riga, Latvia","Offline","Full paper submission deadline: January 31, 2025
Abstract submission deadline: April 30, 2025","Notification of acceptance: March 31, 2025","","","Fuzzy Logic, Fuzzy Systems, Soft Computing, Approximate Reasoning, Decision Making, Fuzzy Control, Machine Learning, Knowledge Representation","Special sessions proposals deadline: October 31-November 10, 2024"
"International Conference on Emerging Ubiquitous Systems and Pervasive Networks","EUSPN","https://cs-conferences.acadiau.ca/euspn-24/","October 28-30, 2024","Leuven, Belgium","Offline","Workshop Proposals Due: June 10, 2024
Papers Submission Due: August 16, 2024
Final Manuscript Due: September 27, 2024","Authors Notifications: September 8, 2024","","","Ubiquitous Systems, Pervasive Networks, Ad hoc Networks, Adaptive Systems, Big Data, Cloud Computing, Internet of Things, Mobile Computing, Wireless Communications",""
"International Conference on Applications of Evolutionary Computation","EvoApplications","https://www.evostar.org/2025/evoapps/","April 12-14, 2023","Brno, Czech Republic","Hybrid (online and onsite)","Submission deadline: November 16, 2022
Late-Breaking Abstracts submission: April 2, 2023","Notification to authors: January 18, 2023","Camera-ready submission: February 1, 2023","Author’s mandatory registration: February 27, 2023
Early registration deadline: March 1, 2023","Evolutionary Computation, Bio-inspired techniques, Social Networks, Sustainability, Edge Computing, Cloud Computing, Image Analysis, Signal Processing, Pattern Recognition, Machine Learning, AI, Digital Healthcare, Personalized Medicine, Resilient Algorithms, Soft Computing, Games, Surrogate-Assisted Optimization","EvoApps Special Session Proposals: September 9, 2022"
"European Conference on Evolutionary Computation in Combinatorial Optimisation","EvoCOP","https://www.evostar.org/2025/evocop/","April 12-14, 2023","Brno, Czech Republic","Hybrid (online and onsite)","Submission deadline: November 16, 2022
Late-Breaking Abstracts submission: April 2, 2023","Notification to authors: January 18, 2023","Camera-ready submission: February 1, 2023","Author’s mandatory registration: February 27, 2023
Early registration deadline: March 1, 2023","Evolutionary Computation, Metaheuristics, Combinatorial Optimization, Scheduling, Timetabling, Network Design, Transportation, Vehicle Routing, Stringology, Graphs, Satisfiability, Energy Optimization","EvoApps Special Session Proposals: September 9, 2022"
"International Conference on Artificial Intelligence in Music, Sound, Art and Design","EvoMUSART","https://www.evostar.org/2025/evomusart/","April 23-25, 2025","Trieste, Italy","Offline","Submission deadline: November 1, 2024","","","","Artificial Intelligence, Music, Sound, Art, Design, Artificial Neural Networks, Evolutionary Computation, Swarm Intelligence, Machine Learning, Deep Learning",""
"International Conference on Embedded Wireless Systems and Networks (wasEuropean Conference on Wireless Sensor Networks)","EWSN","https://ewsn24.tii.ae/","December 10-13, 2024","St. Regis Abu Dhabi, Abu Dhabi, UAE","Offline","Winter deadline Paper submission deadline: February 15, 2024
Summer deadline Paper submission deadline: June 24, 2024","Winter deadline Notification of reviews: March 25, 2024
Winter deadline Notification of acceptance: April 27, 2024
Summer deadline Notification of reviews: August 12, 2024
Summer deadline Notification of acceptance: September 16, 2024","Winter deadline Camera-ready deadline: May 19, 2024
Summer deadline Camera-ready deadline: October 6, 2024","Winter deadline Paper registration and abstract submission deadline: February 15, 2024
Summer deadline Paper registration and abstract submission deadline: June 24, 2024","Embedded Wireless Systems and Networks, Wireless Sensor Networks, Internet of Things, Cyber-Physical Systems, Intelligent and Resilient Networked Embedded Systems","Winter deadline Rebuttal deadline: April 7, 2024
Summer deadline Rebuttal deadline: September 1, 2024"
"Conference on File and Storage Technologies","FAST","https://www.usenix.org/conference/fast25","February 25-27, 2025","Hyatt Regency Santa Clara, Santa Clara, CA, USA","Offline","Paper submissions due: September 17, 2024
Final paper files due: January 28, 2025","Notification to authors: December 6, 2024","","","File and Storage Technologies, Archival Systems, AI for Storage, Cloud Storage, Distributed Storage, File System Design, Hardware Design, HPC Systems, Memory-Only Storage, Novel Storage Technologies","Author response period begins: November 20, 2024
Author response period ends: November 22, 2024"
"Fundamental Approaches to Software Engineering","FASE","https://etaps.org/2025/conferences/fase/","May 5-8, 2025","Hamilton, Canada","Offline","Submission deadline for ESOP, round 1: May 30, 2024
Submission deadline for ESOP round 2: October 10, 2024
Submission deadline for TACAS, FoSSaCS, FASE: October 10, 2024
TACAS mandatory artifact submission deadline: October 24, 2024
ESOP, FASE, FoSSaCS artifact, TACAS voluntary artifact submission deadline: January 9, 2025
Paper final version: January 30, 2025","Notification for ESOP, round 1: August 8, 2024
Paper notification and TACAS mandatory artifact notification: December 20, 2024
Artifact notification ESOP, FASE, FoSSaCS, TACAS (voluntary artifacts): February 13, 2025","","","Software Engineering, AI in Software Engineering, Software Quality, Software Testing, Requirements Engineering, Software Architectures, Model-Driven Engineering, Software Processes, Software Evolution","Rebuttal for ESOP, round 1: July 23-25, 2024
Rebuttal (ESOP, FoSSaCS, partially TACAS): December 3-5, 2024"
"International Symposium on Formal Methods (was Formal Methods Europe FME)","FM","https://www.fm24.polimi.it/","April 14-15, 2024","Lisbon, Portugal","Offline","","","","","Formal Methods",""
"International FLINS Conference on Robotics and Artificial Intelligence (was International Fuzzy Logic and Intelligent technologies in Nuclear Science Conference)","FLINS","https://kmeducationhub.de/international-conference-intelligent-systems-knowledge-engineering-iske/","November 19-21, 2025","Shunde, China","Offline","","","","","Intelligent Systems, Knowledge Engineering, Artificial Intelligence, Intelligent Robots",""
"The International Conference on Future Networks and Communications","FNC","https://icufn.org/","July 8-11, 2025","Iscte - University Institute of Lisbon, Lisbon, Portugal","Offline","Paper Submission Deadline: February 14, 2025","Acceptance Notification: April 25, 2025","Camera-Ready Paper: May 2, 2025","","Ubiquitous and Future Networks, 6G Wireless Systems, Machine Learning, Satellite Communications",""
"IEEE Symposium on Foundations of Computer Science","FOCS","https://ieee-focs.org/","October 11-14, 2003","Cambridge, MA","Offline","Submission deadline: April 7, 2003
Final versions: July 24, 2003","Notification: June 25, 2003","","","Algorithms and Data Structures, Computational Complexity, Cryptography, Computational Geometry",""
"International Workshop on Formal Methods for interactive Systems","FMIS","https://www.irit.fr/recherches/ICS/people/palanque/communityservices.html","","","","","","","","","No information available"
"Conference on Fun with Algorithms","FUN","https://erikdemaine.org/events/?prefix=FUN","June 4-8, 2024","Isola della Maddalena, Italy","Offline","Due: February 27, 2024
Final: April 15, 2024","","","","Algorithms","Accept: April 2, 2024"
"ACM Special Interest Group on Supporting Group Work (was SIGGRoup)","Group","https://kmeducationhub.de/acm-international-conference-on-supporting-group-work-group/","January 12-15, 2025","Hilton Head Island, SC, USA","Offline","","","","","Group Work, Computer Supported Cooperative Work, Human Computer Interaction, Computer Supported Collaborative Learning, Socio-Technical Studies",""
"International Conference on Hybrid Artificial Intelligence Systems","HAIS","https://haisconference.eu/","October 9-11, 2024","Salamanca, Spain","Offline","Submission deadline: June 25, 2024
Final version submission: July 20, 2024","Acceptance notification: May 15, 2024","","","Hybrid Artificial Intelligence Systems, Soft Computing, Computational Intelligence, Data Mining, Machine Learning",""
"British Computer Society Conference on Human-Computer Interaction","HCI","https://2025.hci.international/","June 22-27, 2025","Gothia Towers Hotel and Swedish Exhibition & Congress Centre, Gothenburg, Sweden","Hybrid (on-site with online participation option)","","","","","Human-Computer Interaction, User Interface Design, User Experience, Universal Access","Posters proposals: January 10, 2025
Student designs: March 7, 2025"
"Haskell Workshop","HASKELL","https://discourse.haskell.org/t/call-for-proposals-now-open-for-functional-conf-2025-online/10555","January 24-25, 2025","Online","Online","Submission Deadline: November 17, 2024","","","","Functional Programming",""
"HCist - International Conference on Health and Social Care Information Systems and Technologies","HCist","https://hcist.scika.org/?page=importantdates","November 13-15, 2024","Pestana Casino Park Hotel, Funchal, Madeira, Portugal","Hybrid (online and physical)","Paper submission: July 25, 2024","Notification of results: August 31, 2024","","","Health and Social Care Information Systems and Technologies","Rev. version: September 20, 2024"
"Heterogeneity in Computing Workshop","HCW","https://www.ipdps.org/ipdps2025/2025-workshops.html","June 3-7, 2025","Milan, Italy","Offline","Call for Papers closed: October 10, 2024","","","","Parallel and Distributed Processing, Algorithms, Applications, Architecture, Machine Learning, Measurement, Modeling, Programming Models, Compilers, Runtime Systems, System Software",""
"IEEE international conference on ehealth networking applications and services (was International Workshop on Enterprise Networking and Computing in Health Care Industry; changed 2006)","HealthCom","https://healthcom2024.ieee-healthcom.org/","November 18-20, 2024","Nara, Japan","Offline","Paper Submission: July 18, 2024","Notification of Acceptance: August 30, 2024","Final Manuscript (Camera Ready): September 30, 2024","","E-health, AI, Machine Learning, Fog/Edge/Cloud Computing, Wearable Medical Devices, Biometric Analysis, Signal Processing, Bioinformatics, Communications and Networking",""
"Health Informatics Conference","HIC","https://hicafe.co/event/100/health-innovation-community-hic2025","August 18-20, 2025","Melbourne Convention and Exhibition Centre, Australia","Offline","Call for Submissions opens: November 21, 2024
Submissions close: January 17, 2025
Author revisions: March 28, 2025","Notifications: March 3, 2025","","Author registrations: April 25, 2025","Health Innovation, Connected Care, Data and Innovation, First Nations People Data Sovereignty, Interoperability, Research, Workforce Models of Care",""
"AAAI Conference on Human Computation and Crowdsourcing","HCOMP","https://www.humancomputation.com/program.html","October 16-19, 2024","Pittsburgh, Pennsylvania","Offline","","","","Registration open: ongoing","Human Computation, Crowdsourcing, Artificial Intelligence, Human-Computer Interaction",""
"International Workshop on High-Level Parallel Programming Models and Supportive Environments","HIPS","https://hips2025.github.io/","June 3-7, 2025","Milan, Italy","Offline","Submission due date: January 17, 2025","Author notification: February 21, 2025","Camera-ready papers: March 6, 2025","","High-Level Parallel Programming, Parallel Programming Models, Compilers, Runtime Systems, Programming Tools",""
"Human-Agent Interaction","HAI","https://hai-conference.net/","null","null","null","","","","","Human-Agent Interaction, Robots, Software Agents, AI",""
"International Conference on High Performance Computing","HiPC","https://www.acm.org/articles/acm-india-bulletins/2024/hipc-2024-call-for-papers","December 18-21, 2024","Bangalore, India","Offline","Abstract Submission: June 19, 2024
Paper Submission (double-blind): June 26, 2024
Shepherded Paper Submission: September 27, 2024","Reviews to Authors: August 22, 2024
Author Notification: September 13, 2024
Final Author Notification: October 5, 2024","","","High Performance Computing, Data Science, Machine Learning, Big Data Analytics","Rebuttal Period: August 22-27, 2024"
